{
  "schema_version": 1,
  "span_id": "a3f9b2c14e8d1c5f",
  "trace_id": "a3f9b2c14e8d1c5f6b7a8e9d0c1b2a3f",
  "parent_id": null,
  "name": "context.build",
  "kind": "internal",
  "start_us": 1779131722000000,
  "end_us": 1779131722412000,
  "attrs": {
    "run_id": "20260518-141522-a3f9b2c1",
    "cap_tokens": 65536
  },
  "events": [
    {
      "at_us": 1779131722190000,
      "name": "retrieval.completed",
      "attrs": {
        "candidate_count": 5
      }
    }
  ],
  "status": {
    "code": "ok",
    "message": null
  }
}
